{
  "projection_schema_version": "1.0",
  "data_generated_at": "2026-07-19T02:00:00Z",
  "source_commit_sha": "0123456789abcdef0123456789abcdef01234567",
  "pulled_at": null,
  "task_display_id": "task_a3709aa5c8aa0ac1",
  "parent_task_display_id": "parent_fcef94dc9a495922",
  "phase": "approval_ready",
  "status": "ready",
  "execution_class": "OWNER_APPROVAL",
  "safety_summary": {
    "synthetic_local_only": true,
    "mock_only": true,
    "dry_run": true,
    "owner_review_required": true,
    "external_side_effects_allowed": false,
    "external_side_effects_occurred": false,
    "worker_dispatch_allowed": false,
    "openclaw_call_allowed": false,
    "hermes_runtime_allowed": false,
    "connector_call_allowed": false
  },
  "approval_readiness": "ready_for_owner",
  "decision_summary": {
    "decision": null,
    "decision_timestamp": null
  },
  "evidence_bundle_hash": "9ba98d9bcdd8c659b927e7bdd1b10edbdc94f0f15112ddb19e5270c6e802d7aa",
  "stale_after": "2026-07-19T02:15:00Z"
}
